{
  "artifact_type": "incident_report",
  "artifact_id": "incident-fixture-b",
  "schema_version": "1.0",
  "created_at": "2026-04-02T00:00:00Z",
  "chain_id": "chain-fixture-b",
  "title": "Identity boundary change detected",
  "summary": "Identity mapping drift suggests a protected boundary change",
  "action_class": "class3",
  "proposed_action": "Patch identity registry",
  "scope": ["identity_registry:update"],
  "touched_surfaces": ["identity_registry"],
  "protected_surface_expected": true,
  "is_novel": true,
  "playbook_id": null,
  "playbook_preapproved": false,
  "reversible": false,
  "evidence": ["fingerprint drift"],
  "status": "open"
}
